{
  "id": "ci1",
  "competitor": "Yoga with Adriene",
  "platform": "youtube",
  "contentType": "Long-form",
  "topic": "30-day yoga journeys",
  "engagement": "Very High (8.4%)",
  "frequency": "Daily",
  "insight": "Monthly yoga challenges with daily 20-30 min videos. Strong community engagement in comments. Gentle, accessible approach resonates with 40+ audience."
}
